Id,Symbol,CompanyName,Industry,Exchange,DateTime,Description,TotalShares,StockQuoteId
148,DLTR,Dollar Tree,Consumer Staples,NASDAQ,2025-04-09 00:00:00+00:00,"Dollar Tree, Inc. operates discount variety retail stores. The company offers merchandise at fixed price points through its Dollar Tree and Family Dollar segments. Its stores offer a variety of everyday items, seasonal goods, and consumables.",5795623,148
149,D,Dominion Energy,Utilities,NYSE,2025-04-09 00:00:00+00:00,"Dominion Energy, Inc. is a major energy company that provides electricity and natural gas to millions of customers. The company operates through various segments, including Dominion Energy Virginia, Gas Distribution, and Dominion Energy South Carolina. Dominion Energy is involved in the production, transmission, and distribution of energy resources.",5770266,149
150,DPZ,Domino's,Consumer Discretionary,NYSE,2025-04-09 00:00:00+00:00,"Domino's Pizza, Inc. operates as a pizza restaurant chain. It offers pizzas, as well as other food items and beverages. The company operates primarily through its company-owned stores and franchise stores.",6839562,150
151,DASH,DoorDash,Consumer Discretionary,NYSE,2025-04-09 00:00:00+00:00,"DoorDash operates an online food ordering and delivery platform. It connects customers with local businesses, offering a wide range of products including meals, groceries, and convenience items. The company also provides logistics services to merchants through its DashMart platform.",6850500,151
152,DOV,Dover Corporation,Industrials,NYSE,2025-04-09 00:00:00+00:00,"Dover Corporation is a diversified global manufacturer delivering innovative equipment and components, specialty systems, and support services. Dover's business is conducted through five operating segments: Engineered Products, Clean Energy & Fueling, Imaging & Identification, Pumps & Process Solutions and Climate & Sustainability Technologies.",6454856,152
153,DOW,Dow Inc.,Materials,NYSE,2025-04-09 00:00:00+00:00,"Dow Inc. is a materials science company, providing a range of products and solutions to various industries. It operates through segments like Packaging & Specialty Plastics, Industrial Intermediates & Infrastructure, and Performance Materials & Coatings.",9728213,153
154,DHI,D. R. Horton,Consumer Discretionary,NYSE,2025-04-09 00:00:00+00:00,"D.R. Horton, Inc. is a homebuilding company in the United States. It is engaged in the construction and sale of single-family housing, with operations in multiple states across the country. The company also provides mortgage financing and title services to homebuyers.",7234527,154
155,DTE,DTE Energy,Utilities,NYSE,2025-04-09 00:00:00+00:00,"DTE Energy Company is a diversified energy company involved in the development and management of energy-related businesses and services nationwide. Its operating units include an electric utility and a gas utility, serving millions of customers in Michigan.",7679137,155
156,DUK,Duke Energy,Utilities,NYSE,2025-04-09 00:00:00+00:00,"Duke Energy Corporation is a holding company that provides energy services in the Americas. It operates through regulated utilities and commercial renewables segments, generating, transmitting, and distributing electricity and natural gas.",5779515,156
157,DD,DuPont,Materials,NYSE,2025-04-09 00:00:00+00:00,"DuPont de Nemours, Inc. is a global innovation leader with technology-based materials and solutions. It serves industries such as electronics, transportation, construction, and worker safety. The company delivers essential innovations to help customers thrive.",7555171,157
158,EMN,Eastman Chemical Company,Materials,NYSE,2025-04-09 00:00:00+00:00,"Eastman Chemical Company is a global specialty materials company. It produces a broad range of advanced materials, chemicals, and fibers that are found in products people use every day. Eastman serves customers in nearly 100 countries and is headquartered in Kingsport, Tennessee, USA.",6311874,158
159,ETN,Eaton Corporation,Industrials,NYSE,2025-04-09 00:00:00+00:00,"Eaton Corporation is a power management company. It provides energy-efficient solutions that help customers manage electrical, hydraulic and mechanical power more reliably, efficiently, safely and sustainably. Eaton sells products to companies in the industrial, vehicle, aerospace, and electrical sectors.",6171778,159
160,EBAY,eBay Inc.,Consumer Discretionary,NASDAQ,2025-04-09 00:00:00+00:00,"eBay Inc. operates online marketplaces that connect buyers and sellers worldwide. The company's platforms enable commerce through online, mobile, and offline channels, offering a variety of products and services.",7074266,160
161,ECL,Ecolab,Materials,NYSE,2025-04-09 00:00:00+00:00,"Ecolab Inc. provides water, hygiene, and infection prevention solutions and services. It offers programs and services for the food, healthcare, hospitality, and industrial markets. The company helps customers improve food safety, maintain clean and safe environments, optimize water and energy use, and improve operational efficiencies.",6971443,161
162,EIX,Edison International,Utilities,NYSE,2025-04-09 00:00:00+00:00,"Edison International, through its subsidiaries, generates and distributes electric power. It serves approximately 15 million people in a 50,000-square-mile service territory within Southern California. The company also provides energy services and technologies.",5181706,162
163,EW,Edwards Lifesciences,Health Care,NYSE,2025-04-09 00:00:00+00:00,Edwards Lifesciences Corporation provides products and technologies for structural heart disease and critical care and surgical monitoring worldwide. The company is known for its heart valve technologies and hemodynamic monitoring.,7761606,163
164,EA,Electronic Arts,Communication Services,NASDAQ,2025-04-09 00:00:00+00:00,"Electronic Arts Inc. is a leading global interactive entertainment software company. They develop, market, publish and distribute games, content and services for consoles, PCs, mobile phones and tablets.",8316600,164
165,ELV,Elevance Health,Health Care,NYSE,2025-04-09 00:00:00+00:00,"Elevance Health, Inc., formerly Anthem, Inc., is a health benefits company. It provides a range of managed healthcare services to employer, individual, and government-sponsored health plans. Its offerings include medical, pharmacy, clinical, behavioral, and care solutions.",7223337,165
166,EMR,Emerson Electric,Industrials,NYSE,2025-04-09 00:00:00+00:00,"Emerson Electric Co. is a global technology and engineering company providing solutions for industrial, commercial, and residential markets. The company automates processes, helps customers optimize energy use, and drives sustainable infrastructure solutions.",8636923,166
167,ENPH,Enphase Energy,Information Technology,NASDAQ,2025-04-09 00:00:00+00:00,"Enphase Energy, Inc. is a global energy technology company and a leading provider of microinverter-based solar and storage systems. The company designs, develops, manufactures, and sells home energy solutions, including microinverters, batteries, and software.",5501499,167
168,ETR,Entergy,Utilities,NYSE,2025-04-09 00:00:00+00:00,"Entergy Corporation is an integrated energy company engaged primarily in electric power production and retail distribution operations. Entergy owns and operates power plants with approximately 24,000 megawatts of electric generating capacity, and delivers electricity to 3 million utility customers in Arkansas, Louisiana, Mississippi and Texas.",9830790,168
169,EOG,EOG Resources,Energy,NYSE,2025-04-09 00:00:00+00:00,"EOG Resources, Inc. is one of the largest independent crude oil and natural gas companies in the United States. The company is focused on developing premium drilling locations, primarily in the United States, with an emphasis on horizontal drilling.",9569754,169
170,EPAM,EPAM Systems,Information Technology,NYSE,2025-04-09 00:00:00+00:00,"EPAM Systems, Inc. is a global provider of digital platform engineering and software development services. The company delivers solutions through its software engineering DNA, combined with experience design, consulting, and product strategy capabilities. EPAM serves clients worldwide across various industries.",6013501,170
171,EQT,EQT Corporation,Energy,NYSE,2025-04-09 00:00:00+00:00,"EQT Corporation is a natural gas production company focused on developing the Marcellus Shale in the Appalachian Basin. The company explores for, develops, and produces natural gas, natural gas liquids (NGLs), and crude oil. EQT is committed to responsible energy development and environmental stewardship.",8755793,171
172,EFX,Equifax,Industrials,NYSE,2025-04-09 00:00:00+00:00,"Equifax Inc. is a global data, analytics, and technology company. It provides information solutions and insights for businesses and consumers, helping them make informed decisions.",8533941,172
173,EQIX,Equinix,Real Estate,NASDAQ,2025-04-09 00:00:00+00:00,"Equinix, Inc. connects businesses with partners and customers through a global platform of interconnected data centers. It provides colocation and related services, enabling digital infrastructure for enterprises.",5307679,173
174,EQR,Equity Residential,Real Estate,NYSE,2025-04-09 00:00:00+00:00,"Equity Residential is a real estate investment trust (REIT) that owns and operates high-quality apartment properties in urban and suburban locations. The company focuses on affluent, knowledge-economy coastal markets.",8213836,174
175,ERIE,Erie Indemnity,Financials,NASDAQ,2025-04-09 00:00:00+00:00,"Erie Indemnity Company provides sales, underwriting, and policy-processing services for Erie Insurance Group. It operates as an insurance company, offering a range of property and casualty insurance products.",9044042,175
176,ESS,Essex Property Trust,Real Estate,NYSE,2025-04-09 00:00:00+00:00,"ESS Tech, Inc. designs, builds, and deploys long-duration energy storage systems for commercial and utility-scale applications. Its iron flow batteries provide environmentally safe, long-life energy storage, supporting grid stabilization and renewable energy integration.",9656381,176
177,EL,Estée Lauder Companies (The),Consumer Staples,NYSE,2025-04-09 00:00:00+00:00,"Elevance Health, Inc., formerly Anthem, Inc., is a health benefits company. It provides a range of managed healthcare products and services through its subsidiaries. The company serves employer groups, individual consumers, and government-sponsored programs.",7594977,177
178,EG,Everest Group,Financials,NYSE,2025-04-09 00:00:00+00:00,"EastGroup Properties, Inc. is a self-administered equity real estate investment trust (REIT). The Company is focused on the development, acquisition and operation of industrial properties in major Sunbelt markets. EastGroup's strategy is to target supply-constrained submarkets with strong demographics.",5944400,178
179,EVRG,Evergy,Utilities,NYSE,2025-04-09 00:00:00+00:00,"Evergy, Inc., through its subsidiaries, operates as a public utility holding company. It generates, transmits, and distributes electricity to residential, commercial, and industrial customers in Kansas and Missouri. The company also provides natural gas service in certain areas.",6611262,179
180,ES,Eversource Energy,Utilities,CME,2025-04-09 00:00:00+00:00,E-Mini S&P 500 Futures. This contract represents a claim on the future value of the S&P 500 stock index. It is widely used for hedging and speculation on the overall U.S. stock market.,9584501,180
181,EXC,Exelon,Utilities,NASDAQ,2025-04-09 00:00:00+00:00,"Exelon Corporation is a utility services holding company. It engages in the energy generation, delivery, and retail businesses. The company serves customers in Delaware, the District of Columbia, Illinois, Maryland, New Jersey, and Pennsylvania.",6507918,181
182,EXE,Expand Energy,Energy,NYSE,2025-04-09 00:00:00+00:00,"IDEX Corporation is a global fluidics leader serving high-growth specialized markets. The company focuses on positive displacement flow technologies, along with other niche products.",7879023,182
183,EXPE,Expedia Group,Consumer Discretionary,NASDAQ,2025-04-09 00:00:00+00:00,"Expedia Group, Inc. is an online travel company. It offers a wide range of travel products and services to leisure and corporate travelers globally, including lodging, air, car rental, and activities. Its portfolio of brands includes Expedia, Hotels.com, Vrbo, and others.",7059059,183
184,EXPD,Expeditors International,Industrials,NASDAQ,2025-04-09 00:00:00+00:00,"Expeditors International of Washington, Inc. is a global logistics company. It provides freight forwarding, customs brokerage, and other logistics services to businesses worldwide. The company manages and optimizes supply chains for its customers.",6702663,184
185,EXR,Extra Space Storage,Real Estate,NYSE,2025-04-09 00:00:00+00:00,"Extra Space Storage Inc. is a self-administered and self-managed REIT. The Company owns, operates, manages, develops, and acquires self-storage properties. It is one of the largest operators of self-storage stores in the United States.",6272834,185
186,XOM,ExxonMobil,Energy,NYSE,2025-04-09 00:00:00+00:00,"Exxon Mobil Corporation is an integrated oil and gas company. It explores for and produces crude oil and natural gas, manufactures petroleum products, and transports and sells crude oil, natural gas, and petroleum products.",6570442,186
187,FFIV,"F5, Inc.",Information Technology,NASDAQ,2025-04-09 00:00:00+00:00,"F5, Inc. is a multinational company that specializes in application security and delivery. Its solutions enable organizations to develop, deploy, operate, secure, and govern applications across any environment.",9479665,187
188,FDS,FactSet,Financials,NYSE,2025-04-09 00:00:00+00:00,"FactSet Research Systems Inc. provides integrated financial information and analytical applications to the global investment community. It delivers insight and information to investment professionals through superior analytics, service, content, and technology.",5376354,188
189,FICO,Fair Isaac,Information Technology,NYSE,2025-04-09 00:00:00+00:00,"Fair Isaac Corporation (FICO) is a data analytics company focused on credit scoring services. It provides analytics software and tools used for credit, fraud, and marketing risk management across various industries.",5569098,189
190,FAST,Fastenal,Industrials,NASDAQ,2025-04-09 00:00:00+00:00,"Fastly, Inc. operates an edge cloud platform to deliver, secure, and optimize online experiences. Its platform offers compute, delivery, and security services, enabling businesses to build, secure, and deliver digital experiences at scale.",6548793,190
191,FRT,Federal Realty Investment Trust,Real Estate,NYSE,2025-04-09 00:00:00+00:00,"Federal Realty Investment Trust is a real estate investment trust (REIT) specializing in the ownership, management, and redevelopment of high-quality retail properties. They focus on densely populated, affluent communities in major coastal markets.",5606057,191
192,FDX,FedEx,Industrials,NYSE,2025-04-09 00:00:00+00:00,"FedEx Corporation provides a broad portfolio of transportation, e-commerce, and business services. It offers integrated business applications through companies competing collectively and managed collaboratively, under the respected FedEx brand.",8927267,192
193,FIS,Fidelity National Information Services,Financials,NYSE,2025-04-09 00:00:00+00:00,"Fidelity National Information Services (FIS) is a financial technology company providing a wide range of solutions for merchants, banks, and capital markets firms globally. Their services include payment processing, banking solutions, and wealth and retirement solutions, enabling clients to optimize their operations and deliver better customer experiences.",5391274,193
194,FITB,Fifth Third Bancorp,Financials,NASDAQ,2025-04-09 00:00:00+00:00,"Fifth Third Bancorp is a diversified financial services company headquartered in Cincinnati, Ohio. It operates through a network of banking centers and offers a range of financial products and services to individuals, businesses, and institutions.",5461190,194
195,FSLR,First Solar,Information Technology,NASDAQ,2025-04-09 00:00:00+00:00,"First Solar, Inc. is a leading American solar technology company and global provider of photovoltaic (PV) solar energy solutions. They design, manufacture, and sell PV solar modules with an advanced thin-film semiconductor technology, and also develop, construct, and operate some of the world's largest grid-connected PV power plants.",9417360,195
196,FE,FirstEnergy,Utilities,NYSE,2025-04-09 00:00:00+00:00,"FirstEnergy Corp. is a holding company that provides a wide range of services, including electricity generation, transmission, and distribution. It serves customers in Ohio, Pennsylvania, New Jersey, West Virginia, Maryland, and New York.",5639931,196
197,FI,Fiserv,Financials,NYSE,2025-04-09 00:00:00+00:00,"Frank's International N.V., through its subsidiaries, provides engineered tubular services to the oil and gas industry. It offers a range of products and services for the construction and completion of oil and gas wells, including tubular running services, tubular fabrication, and specialty connections.",5267073,197
198,F,Ford Motor Company,Consumer Discretionary,NYSE,2025-04-09 00:00:00+00:00,"Ford Motor Company designs, manufactures, markets, and services a range of Ford trucks, cars, sport utility vehicles, electrified vehicles, and Lincoln luxury vehicles worldwide. It operates through three segments: Ford Blue, Ford Model e, and Ford Pro.",8156677,198
199,FTNT,Fortinet,Information Technology,NASDAQ,2025-04-09 00:00:00+00:00,"Fortinet, Inc. provides cybersecurity solutions worldwide. The company offers a broad portfolio of security solutions, including firewalls, intrusion prevention systems, and endpoint security, designed to protect networks, users, and data from increasingly sophisticated cyber threats.",7896164,199
200,FTV,Fortive,Industrials,NYSE,2025-04-09 00:00:00+00:00,"Fortive Corporation is a diversified industrial technology company. It designs, develops, manufactures, and markets professional and engineered products, software, and services for a variety of end markets.",8822632,200
201,FOXA,Fox Corporation (Class A),Communication Services,NASDAQ,2025-04-09 00:00:00+00:00,"Fox Corporation produces and distributes news, sports, and entertainment content. It operates through segments like Cable Network Programming, Television, and Filmed Entertainment. Its brands include FOX News, FOX Sports, and FOX Entertainment.",5396629,201
202,FOX,Fox Corporation (Class B),Communication Services,NASDAQ,2025-04-09 00:00:00+00:00,"Fox Corporation is a news, sports and entertainment company. It creates and distributes content through its primary segments: Cable Network Programming; Television; and Filmed Entertainment.",9077160,202
203,BEN,Franklin Resources,Financials,NYSE,2025-04-09 00:00:00+00:00,"Franklin Resources, Inc. [BEN] is a global investment management organization operating as Franklin Templeton. The company provides investment management and related services to retail, institutional, and high-net-worth clients in jurisdictions worldwide.",6528906,203
204,FCX,Freeport-McMoRan,Materials,NYSE,2025-04-09 00:00:00+00:00,"Freeport-McMoRan Inc. is a leading international mining company with headquarters in Phoenix, Arizona. It operates large, long-lived, geographically diverse assets with significant proven and probable reserves of copper, gold, and molybdenum.",9003357,204
205,GRMN,Garmin,Consumer Discretionary,NYSE,2025-04-09 00:00:00+00:00,"Garmin Ltd. designs, develops, manufactures, and markets a diverse range of navigation, communication, and information devices and applications. Its products serve the automotive, aviation, marine, outdoor recreation, and fitness markets.",6482235,205
206,IT,Gartner,Information Technology,NYSE,2025-04-09 00:00:00+00:00,"Gartner, Inc. delivers actionable, objective insight to executives and their teams. Their expert guidance and tools enable faster, smarter decisions and stronger performance on mission-critical priorities. They equip leaders at every level with the data-driven insights they need to make the right decisions with confidence.",7739894,206
207,GE,GE Aerospace,Industrials,NYSE,2025-04-09 00:00:00+00:00,"General Electric (GE) is a global high-tech industrial company. It operates through various segments including aviation, healthcare, and power, providing products and services ranging from jet engines and medical imaging to power generation equipment.",9946820,207
208,GEHC,GE HealthCare,Health Care,NASDAQ,2025-04-09 00:00:00+00:00,"GE HealthCare Technologies Inc. is a global medical technology, pharmaceutical diagnostics, and digital solutions innovator. The company provides technologies, digital infrastructure, data analytics and solutions to enable clinicians to make faster, more informed decisions through intelligent devices, data analytics, applications and services.",9822333,208
209,GEV,GE Vernova,Industrials,NASDAQ,2025-04-09 00:00:00+00:00,"Gevo, Inc. is a renewable chemicals and advanced biofuels company focused on developing and commercializing bio-based alternatives to petroleum-based products. The company utilizes its proprietary technology to convert renewable resources into sustainable aviation fuel, renewable gasoline, and other valuable products.",6373515,209
210,GEN,Gen Digital,Information Technology,NYSE,2025-04-09 00:00:00+00:00,"General Electric Company (GE) is a high-tech industrial company. It operates through aviation, healthcare, and power segments, providing products and services ranging from aircraft engines and medical imaging to power generation equipment.",9774108,210
211,GNRC,Generac,Industrials,NASDAQ,2025-04-09 00:00:00+00:00,"Generac Power Systems is a leading manufacturer of power generation equipment, energy storage systems, and other power products. The company serves residential, commercial, and industrial markets, providing backup power solutions and prime power systems.",6158003,211
212,GD,General Dynamics,Industrials,XETRA,2025-04-09 00:00:00+00:00,"Gerresheimer AG manufactures and sells specialty glass and plastic products worldwide. It offers pharmaceutical packaging, such as vials, ampoules, cartridges, bottles, eye droppers, closures, and containers; and medical devices, including inhalers, insulin pens, and prefillable syringes.",9525883,212
213,GIS,General Mills,Consumer Staples,NYSE,2025-04-09 00:00:00+00:00,"The Hershey Company is a global confectionery leader known for its chocolate, sweets, mints, and other snacks. It manufactures and markets products under popular brands like Hershey's, Reese's, Kit Kat (in the U.S.), and Ice Breakers.",7201356,213
214,GM,General Motors,Consumer Discretionary,NYSE,2025-04-09 00:00:00+00:00,"General Motors is a global automotive company engaged in designing, manufacturing, and selling cars, trucks, and auto parts worldwide. It also provides automotive financing services through General Motors Financial Company.",7150944,214
215,GPC,Genuine Parts Company,Consumer Discretionary,NYSE,2025-04-09 00:00:00+00:00,"Genuine Parts Company distributes automotive and industrial replacement parts and materials. It operates through Automotive Parts, Industrial Parts, and Business Products segments. The company serves automotive repair shops, industrial customers, and office supply dealers.",8989730,215
216,GILD,Gilead Sciences,Health Care,NASDAQ,2025-04-09 00:00:00+00:00,"Gilead Sciences, Inc. is a biopharmaceutical company that discovers, develops, and commercializes medicines in areas of unmet medical need. The company focuses primarily on antiviral drugs used in the treatment of HIV, hepatitis B, hepatitis C, and influenza.",8508486,216
217,GPN,Global Payments,Financials,NYSE,2025-04-09 00:00:00+00:00,Global Payments Inc. is a leading worldwide provider of payment technology and software solutions. The company delivers innovative services that enable its customers to accept all payment types across a variety of distribution channels in many markets around the world.,9533465,217
218,GL,Globe Life,Financials,NYSE,2025-04-09 00:00:00+00:00,"Globus Medical is a medical device company focused on the design, development, and commercialization of musculoskeletal implants. The company offers a comprehensive portfolio of spinal and orthopedic solutions designed to improve the quality of life for patients with musculoskeletal disorders.",7831828,218
219,GDDY,GoDaddy,Information Technology,NYSE,2025-04-09 00:00:00+00:00,"GoDaddy Inc. provides internet domain registration and website hosting services. It also offers marketing tools, security, and e-commerce solutions for small businesses and individuals.",5295376,219
220,GS,Goldman Sachs,Financials,NYSE,2025-04-09 00:00:00+00:00,"The Goldman Sachs Group, Inc. is a leading global investment banking, securities and investment management firm. It provides a wide range of financial services to a substantial and diversified client base that includes corporations, financial institutions, governments and individuals.",9957391,220
221,HAL,Halliburton,Energy,NYSE,2025-04-09 00:00:00+00:00,"Halliburton Company is one of the world's largest providers of products and services to the energy industry. It operates through two segments: Completion and Production, and Drilling and Evaluation.",9682216,221
222,HIG,Hartford (The),Financials,NYSE,2025-04-09 00:00:00+00:00,"The Hartford Financial Services Group, Inc. is a holding company for property and casualty insurance and group benefits operations. It provides a range of commercial property and casualty insurance, group benefits, and mutual funds and is dedicated to helping its customers prevail through life's challenges.",7600611,222
