Id,Symbol,CompanyName,Industry,Exchange,DateTime,Description,TotalShares,StockQuoteId
298,MPC,Marathon Petroleum,Energy,NYSE,2025-04-09 00:00:00+00:00,"Marathon Petroleum Corporation is an American petroleum refining, marketing, and transportation company. It is one of the largest independent refiners in the United States, operating through refining and marketing, and midstream segments.",6018224,298
299,MKTX,MarketAxess,Financials,NASDAQ,2025-04-09 00:00:00+00:00,"MarketAxess Holdings Inc. operates an electronic trading platform for fixed-income securities. It provides access to global liquidity in U.S. high-grade corporate bonds, emerging markets and high-yield bonds, European bonds, U.S. agency securities, and credit default swaps.",8804930,299
300,MAR,Marriott International,Consumer Discretionary,NASDAQ,2025-04-09 00:00:00+00:00,"Marriott International, Inc. operates, franchises, and licenses lodging properties. It manages and franchises hotels, resorts, and residential properties globally, offering a variety of brands across different price points and service levels.",9235604,300
301,MMC,Marsh McLennan,Financials,NYSE,2025-04-09 00:00:00+00:00,"Marsh & McLennan Companies is a professional services firm providing advice and solutions in the areas of risk, strategy, and human capital. The Company operates through its subsidiaries Marsh, Guy Carpenter, Mercer, and Oliver Wyman.",6259898,301
302,MLM,Martin Marietta Materials,Materials,NYSE,2025-04-09 00:00:00+00:00,"Martin Marietta Materials, Inc. produces and supplies construction aggregates, cement, and downstream products. These materials are used for infrastructure, nonresidential, and residential construction.",5603787,302
303,MAS,Masco,Industrials,NYSE,2025-04-09 00:00:00+00:00,"Masco Corporation designs, manufactures, and distributes home improvement and building products. Its product lines include faucets, plumbing supplies, paints, cabinets, and architectural coatings. The company sells its products under brands such as Delta, Behr, and KraftMaid.",8154277,303
304,MA,Mastercard,Financials,NYSE,2025-04-09 00:00:00+00:00,"Mastercard Incorporated is a global technology company that provides transaction processing and payment-related services. It connects consumers, financial institutions, merchants, and governments worldwide, enabling electronic forms of payment.",5929011,304
305,MTCH,Match Group,Communication Services,NASDAQ,2025-04-09 00:00:00+00:00,"Match Group, Inc. provides dating products worldwide. Its portfolio includes Tinder, Match, Hinge, Meetic, OkCupid, PlentyOfFish, OurTime, Azar, and Hakuna. The company's products are available in over 40 languages.",5513162,305
306,MKC,McCormick & Company,Consumer Staples,NYSE,2025-04-09 00:00:00+00:00,"McCormick & Company, Incorporated manufactures, markets, and distributes spices, seasoning mixes, condiments, and other flavorful products to the entire food industry. It operates through two segments: Consumer and Flavor Solutions.",8518227,306
307,MCD,McDonald's,Consumer Discretionary,NYSE,2025-04-09 00:00:00+00:00,"McDonald's Corporation operates and franchises McDonald's restaurants. It offers a variety of food items, soft drinks, coffee, and other beverages. The company operates primarily through franchise agreements.",8488599,307
308,MCK,McKesson Corporation,Health Care,NYSE,2025-04-09 00:00:00+00:00,"McKesson Corporation is a healthcare services and information technology company. It distributes pharmaceuticals and provides healthcare information technology, medical supplies, and care management tools.",9785667,308
309,MDT,Medtronic,Health Care,NYSE,2025-04-09 00:00:00+00:00,"Medtronic plc is a global healthcare technology company that develops and manufactures a wide range of medical devices and therapies. Its products are used to treat over 70 health conditions, including cardiac and vascular diseases, diabetes, neurological and spinal conditions, and surgical procedures. The company operates in four segments: Cardiovascular, Neuroscience, Medical Surgical, and Diabetes.",8796288,309
310,MRK,Merck & Co.,Health Care,NYSE,2025-04-09 00:00:00+00:00,"Merck & Co., Inc. is a global pharmaceutical company that discovers, develops, manufactures, and markets a wide range of healthcare solutions. It offers medicines, vaccines, biologic therapies, and animal health products.",9193917,310
311,META,Meta Platforms,Communication Services,NASDAQ,2025-04-09 00:00:00+00:00,"Meta Platforms, Inc. develops products that enable people to connect and share with friends and family through mobile devices, personal computers, virtual reality headsets, and wearables worldwide. Its products include Facebook, Instagram, Messenger, and WhatsApp.",6454855,311
312,MET,MetLife,Financials,NYSE,2025-04-09 00:00:00+00:00,"MetLife, Inc. is a global financial services company, providing insurance, annuities, employee benefits and asset management. The company serves individual and institutional customers worldwide.",5655080,312
313,MTD,Mettler Toledo,Health Care,NYSE,2025-04-09 00:00:00+00:00,"Mettler-Toledo International Inc. is a global manufacturer and marketer of precision instruments and services. The company's products are used in laboratories, industrial manufacturing, and food retailing applications. They offer a range of analytical instruments, scales, and related services.",6898237,313
314,MGM,MGM Resorts,Consumer Discretionary,NYSE,2025-04-09 00:00:00+00:00,"MGM Resorts International is a global entertainment company. It operates casino resorts, offering gaming, hospitality, dining, entertainment, and retail experiences.",9999729,314
315,MCHP,Microchip Technology,Information Technology,NASDAQ,2025-04-09 00:00:00+00:00,"Microchip Technology Incorporated is a leading provider of microcontroller, mixed-signal, analog and Flash-IP solutions. Their products serve a wide range of applications, offering low-risk product development, lower total system cost and faster time to market for thousands of diverse customer applications worldwide.",6849952,315
316,MU,Micron Technology,Information Technology,NASDAQ,2025-04-09 00:00:00+00:00,"Micron Technology, Inc. is a global leader in memory and storage solutions. The company manufactures and markets DRAM, NAND, and NOR memory products for various applications including computers, mobile devices, and data storage.",7134309,316
317,MSFT,Microsoft,Information Technology,NASDAQ,2025-04-09 00:00:00+00:00,"Microsoft Corporation develops, licenses, and supports software, services, devices, and solutions worldwide. Its products include operating systems, cross-device productivity applications, and server applications.",9511206,317
318,MAA,Mid-America Apartment Communities,Real Estate,NYSE,2025-04-09 00:00:00+00:00,"Mid-America Apartment Communities is a real estate investment trust (REIT) focused on the acquisition, development, redevelopment, and management of multifamily apartment communities primarily in the Southeast, Southwest, and Mid-Atlantic regions of the United States. MAA's portfolio is designed to provide a diverse mix of high-quality apartment homes.",7458309,318
319,MRNA,Moderna,Health Care,NASDAQ,2025-04-09 00:00:00+00:00,"Moderna, Inc. is a biotechnology company pioneering messenger RNA (mRNA) therapeutics and vaccines. The company's mRNA platform is used to develop therapies for infectious diseases, cancer, and other conditions.",9613377,319
320,MHK,Mohawk Industries,Consumer Discretionary,NYSE,2025-04-09 00:00:00+00:00,"Mohawk Industries is a leading global manufacturer of flooring products. They offer a comprehensive range of carpets, rugs, ceramic tile, laminate, wood, stone, and vinyl flooring.",6013980,320
321,MOH,Molina Healthcare,Health Care,NYSE,2025-04-09 00:00:00+00:00,"Molina Healthcare, Inc. provides managed healthcare services under the Medicaid and Medicare programs and through the Health Insurance Marketplace. The company focuses on government-sponsored healthcare programs for low-income families and individuals.",5083412,321
322,TAP,Molson Coors Beverage Company,Consumer Staples,NYSE,2025-04-09 00:00:00+00:00,"Molson Coors Beverage Company manufactures, markets, and sells beer and other beverage products. It offers a portfolio of brands, including Coors Light, Miller Lite, Molson Canadian, Carling, and Blue Moon.",6573275,322
323,MDLZ,Mondelez International,Consumer Staples,NASDAQ,2025-04-09 00:00:00+00:00,"Mondelez International, Inc. manufactures and markets snack food and beverage products worldwide. Its product categories include biscuits, chocolate, gum & candy, and cheese & grocery.",7008631,323
324,MPWR,Monolithic Power Systems,Information Technology,NASDAQ,2025-04-09 00:00:00+00:00,"Monolithic Power Systems, Inc. designs, develops, manufactures, and markets power solutions. The company's portfolio includes DC-to-DC power solutions used in various sectors like computing, automotive, industrial, and communications infrastructure. They focus on high-performance, integrated solutions that save energy and improve system efficiency.",6798083,324
325,MNST,Monster Beverage,Consumer Staples,NASDAQ,2025-04-09 00:00:00+00:00,"Monster Beverage Corporation develops, markets, and distributes energy drink beverages. The company offers a variety of energy drinks, including Monster Energy, Monster Energy Ultra, and NOS.",7039767,325
326,MCO,Moody's Corporation,Financials,NYSE,2025-04-09 00:00:00+00:00,"Moody's Corporation is a global integrated risk assessment firm that empowers organizations to make better decisions. The company provides credit ratings and assessments, research, data and analytical tools, and related software and services.",9976234,326
327,MS,Morgan Stanley,Financials,MSFT,2025-04-09 00:00:00+00:00,"Microsoft Corporation develops, licenses, and supports software, services, devices, and solutions worldwide. Its products include operating systems, cross-device productivity applications, server applications, and cloud-based solutions.",5115046,327
328,MOS,Mosaic Company (The),Materials,NYSE,2025-04-09 00:00:00+00:00,The Mosaic Company is a leading producer and marketer of concentrated phosphate and potash crop nutrients. Mosaic helps farmers increase crop yields and improve agricultural productivity worldwide.,5485457,328
329,MSI,Motorola Solutions,Information Technology,NYSE,2025-04-09 00:00:00+00:00,"Motorola Solutions, Inc. provides mission-critical communications, video, and software solutions for public safety and commercial customers. It serves government, law enforcement, and enterprise clients worldwide, offering products and services like two-way radios, software applications, and video security systems.",6010304,329
330,MSCI,MSCI Inc.,Financials,NYSE,2025-04-09 00:00:00+00:00,"MSCI Inc. is a leading provider of research-based indexes and analytics. The company offers a range of products and services including indexes, portfolio construction and risk management tools, and ESG research.",7078790,330
331,NDAQ,"Nasdaq, Inc.",Financials,NASDAQ,2025-04-09 00:00:00+00:00,"Nasdaq, Inc. is a global technology company serving the capital markets and beyond. It provides data, analytics, software, and services to help clients optimize their business and navigate the markets with confidence.",5212348,331
332,NTAP,NetApp,Information Technology,NASDAQ,2025-04-09 00:00:00+00:00,"NetApp, Inc. is a global cloud-led, data-centric software company. The company provides systems, software, and cloud services for data management and storage. Its solutions enable organizations to manage and share data across on-premises, private, and public clouds.",8509468,332
333,NFLX,Netflix,Communication Services,NASDAQ,2025-04-09 00:00:00+00:00,"Netflix is a leading streaming entertainment service, providing a wide variety of award-winning TV shows, movies, anime, documentaries, and more on-demand. It has a global subscriber base and produces original content.",9968522,333
334,NEM,Newmont,Materials,NYSE,2025-04-09 00:00:00+00:00,"Newmont Corporation is a leading gold producer. The company explores for and processes gold, copper, silver, zinc, and lead. Newmont has operations and assets in the United States, Australia, Peru, Ghana, and Suriname.",7689778,334
335,NWSA,News Corp (Class A),Communication Services,NASDAQ,2025-04-09 00:00:00+00:00,News Corporation is a global media and information services company. It focuses on creating and distributing authoritative and engaging content to consumers and businesses worldwide.,5383050,335
336,NWS,News Corp (Class B),Communication Services,NASDAQ,2025-04-09 00:00:00+00:00,News Corporation is a global media and information services company. It focuses on creating and distributing authoritative and engaging content to consumers and businesses throughout the world.,7444205,336
337,NEE,NextEra Energy,Utilities,NYSE,2025-04-09 00:00:00+00:00,"NextEra Energy, Inc. is a leading clean energy company. It generates and distributes electricity, primarily in Florida, and is the world's largest generator of renewable energy from the wind and sun.",9970523,337
338,NKE,"Nike, Inc.",Consumer Discretionary,NYSE,2025-04-09 00:00:00+00:00,"Nike, Inc. designs, develops, markets, and sells athletic footwear, apparel, equipment, and accessories worldwide. It is the world's largest supplier of athletic shoes and apparel and a major manufacturer of sports equipment.",8523023,338
339,NI,NiSource,Utilities,NYSE,2025-04-09 00:00:00+00:00,NiSource Inc. is a fully regulated utility company. It provides natural gas and electric service to approximately 3.3 million customers across six states in the Midwest and Mid-Atlantic regions of the United States.,7207800,339
340,NDSN,Nordson Corporation,Industrials,NASDAQ,2025-04-09 00:00:00+00:00,"Nordson Corporation engineers, manufactures, and markets differentiated products and systems used to dispense, apply, and control adhesives, coatings, polymers, sealants, biomaterials, and other fluids. The company serves a wide variety of end markets including packaging, nonwovens, electronics, medical, and general industrial.",8922928,340
341,NSC,Norfolk Southern,Industrials,NYSE,2025-04-09 00:00:00+00:00,"Norfolk Southern Corporation is a major freight railroad operator in the United States. It engages in the rail transportation of raw materials, intermediate products, and finished goods primarily in the Southeastern, Eastern, and Midwestern U.S.",5110502,341
342,NTRS,Northern Trust,Financials,NASDAQ,2025-04-09 00:00:00+00:00,"Northern Trust Corporation is a financial holding company. It provides wealth management, asset servicing, asset management and banking solutions to corporations, institutions, families and individuals.",8427917,342
343,NOC,Northrop Grumman,Industrials,NYSE,2025-04-09 00:00:00+00:00,"Northrop Grumman Corporation is an aerospace and defense technology company. It provides systems, products, and solutions in autonomous systems, strike, space, and command, control, communications, computers, intelligence, surveillance, and reconnaissance (C4ISR).",7232995,343
344,NCLH,Norwegian Cruise Line Holdings,Consumer Discretionary,NYSE,2025-04-09 00:00:00+00:00,"Norwegian Cruise Line Holdings Ltd. operates as a cruise company. It offers cruises under the Norwegian Cruise Line, Oceania Cruises, and Regent Seven Seas Cruises brands, covering various destinations worldwide.",5913326,344
345,NRG,NRG Energy,Utilities,NYSE,2025-04-09 00:00:00+00:00,"NRG Energy is an integrated power company that provides electricity and natural gas to homes and businesses in the United States. The company generates and sells electricity, capacity, and related products and services in major competitive power markets.",6710038,345
346,NUE,Nucor,Materials,NYSE,2025-04-09 00:00:00+00:00,"Nucor Corporation manufactures and sells steel and steel products. It operates through three segments: Steel Mills, Steel Products, and Raw Materials. The Steel Mills segment produces sheet steel, plate steel, structural steel, and bar steel.",6679783,346
347,NVDA,Nvidia,Information Technology,NASDAQ,2025-04-09 00:00:00+00:00,"NVIDIA Corporation is a global technology company that designs and manufactures graphics processing units (GPUs). Its products drive advancements in gaming, artificial intelligence, and data center technologies.",9624022,347
348,NVR,"NVR, Inc.",Consumer Discretionary,NYSE,2025-04-09 00:00:00+00:00,"NVR, Inc. is a homebuilder in the United States, primarily operating in the Mid-Atlantic, Northeast, Mid-East, Southeast, and Midwest regions. The company builds and sells single-family detached homes, townhomes, and condominium buildings under the Ryan Homes, NVHomes, and Heartland Homes brands.",6149448,348
349,NXPI,NXP Semiconductors,Information Technology,NASDAQ,2025-04-09 00:00:00+00:00,"NXP Semiconductors N.V. provides high-performance mixed signal and standard product solutions. The company focuses on high-growth applications, including automotive, industrial & IoT, mobile, and communication infrastructure. NXP offers products and solutions for security, identification, power management, interface, communication, and logic applications.",9647892,349
350,ORLY,O’Reilly Automotive,Consumer Discretionary,NASDAQ,2025-04-09 00:00:00+00:00,"O'Reilly Automotive, Inc. is a specialty retailer of automotive aftermarket parts, tools, supplies, equipment and accessories in the United States. They serve both professional service providers and do-it-yourself customers.",5925958,350
351,OXY,Occidental Petroleum,Energy,NYSE,2025-04-09 00:00:00+00:00,"Occidental Petroleum Corporation is an international energy company with operations in the United States, Middle East and Latin America. It is one of the largest oil producers in the U.S., including a leading producer in the Permian and DJ basins, and has carbon management and chemicals businesses.",7694560,351
352,ODFL,Old Dominion,Industrials,NASDAQ,2025-04-09 00:00:00+00:00,"Old Dominion Freight Line, Inc. is a leading less-than-truckload (LTL) carrier providing regional, inter-regional and national LTL services. The company offers a range of value-added services including ground and air expedited transportation, supply chain consulting, and warehousing.",8474714,352
353,OMC,Omnicom Group,Communication Services,NYSE,2025-04-09 00:00:00+00:00,"Omnicom Group Inc. is a global marketing and corporate communications company. It provides advertising, strategic media planning and buying, digital and interactive marketing, direct marketing, and public relations services to a diverse range of clients.",5682916,353
354,ON,ON Semiconductor,Information Technology,NASDAQ,2025-04-09 00:00:00+00:00,"ON Semiconductor Corporation, doing business as onsemi, is a global semiconductor supplier company. They offer a portfolio of power and sensing solutions, focused on automotive, industrial, cloud power, and IoT markets.",9319651,354
355,OKE,Oneok,Energy,NYSE,2025-04-09 00:00:00+00:00,"ONEOK, Inc. is a leading midstream service provider and owns one of the nation's premier natural gas liquids (NGL) systems, connecting NGL supply in the Rocky Mountain, Mid-Continent and Permian regions with key market centers. ONEOK is a FORTUNE 500 company and is included in the S&P 500.",6390522,355
356,ORCL,Oracle Corporation,Information Technology,NYSE,2025-04-09 00:00:00+00:00,"Oracle Corporation is a multinational computer technology corporation. It sells database software and technology, cloud engineered systems, and enterprise software products—particularly its own brands of database management systems.",6650067,356
357,OTIS,Otis Worldwide,Industrials,NYSE,2025-04-09 00:00:00+00:00,"Otis Worldwide Corporation is the world's leading elevator and escalator manufacturing, installation, and service company. They provide access to buildings and urban spaces through innovative products and services.",6085826,357
358,PCAR,Paccar,Industrials,NASDAQ,2025-04-09 00:00:00+00:00,"PACCAR Inc is a global technology leader in the design, manufacture and customer support of high-quality light-, medium- and heavy-duty trucks under the Kenworth, Peterbilt and DAF nameplates. PACCAR also designs and manufactures advanced powertrains, provides financial services and information technology, and distributes truck parts related to its principal business.",8615624,358
359,PKG,Packaging Corporation of America,Materials,UNK,2025-04-09 00:00:00+00:00,UNK,7897703,359
360,PLTR,Palantir Technologies,Information Technology,NASDAQ,2025-04-09 00:00:00+00:00,Palantir Technologies builds and deploys software platforms for data analysis. Its platforms are used by organizations to integrate large disparate datasets to help them make data-driven decisions. Palantir serves commercial and government clients.,8706031,360
361,PANW,Palo Alto Networks,Information Technology,NASDAQ,2025-04-09 00:00:00+00:00,"Palo Alto Networks is a global cybersecurity leader. The company offers a comprehensive security platform to protect organizations from cyberattacks. Their solutions include network security, cloud security, and endpoint security.",6868418,361
362,PARA,Paramount Global,Communication Services,NASDAQ,2025-04-09 00:00:00+00:00,"Paramount Global is a leading global media and entertainment company that creates premium content and experiences for audiences worldwide. Its portfolio includes iconic brands across film, television, streaming, and digital media.",8139757,362
363,PH,Parker Hannifin,Industrials,NYSE,2025-04-09 00:00:00+00:00,"Parker-Hannifin Corporation manufactures and sells motion and control technologies and systems for various mobile, industrial, and aerospace markets. It operates through Diversified Industrial and Aerospace Systems segments.",5282158,363
364,PAYX,Paychex,Industrials,NASDAQ,2025-04-09 00:00:00+00:00,"Paychex, Inc. provides integrated human capital management (HCM) solutions for small to medium-sized businesses. The company offers payroll, benefits, HR, and insurance services to manage the complexities of running a business.",5210028,364
365,PAYC,Paycom,Industrials,NASDAQ,2025-04-09 00:00:00+00:00,"Paycom Software, Inc. provides cloud-based human capital management (HCM) solutions. Its comprehensive platform streamlines various HR processes, including payroll, talent management, and time and attendance tracking, for businesses of all sizes.",9514493,365
366,PYPL,PayPal,Financials,NASDAQ,2025-04-09 00:00:00+00:00,"PayPal Holdings, Inc. operates a technology platform that enables digital payments on behalf of merchants and consumers worldwide. It provides payment solutions, allowing users to send and receive payments in approximately 200 markets and 100 currencies.",9975395,366
367,PNR,Pentair,Industrials,NYSE,2025-04-09 00:00:00+00:00,"Pentair plc is a global water, fluid, thermal management, and equipment protection company. It operates in two segments: Water Solutions and Electrical Solutions. The Water Solutions segment provides a wide range of products and solutions for residential, commercial, industrial, and infrastructure applications.",6522190,367
368,PEP,PepsiCo,Consumer Staples,NASDAQ,2025-04-09 00:00:00+00:00,"PepsiCo, Inc. is a global food and beverage company. Its portfolio includes a wide range of brands, including Pepsi-Cola, Mountain Dew, Gatorade, Lay's, and Doritos. The company manufactures, markets, and distributes these products across the world.",5222732,368
369,PFE,Pfizer,Health Care,NYSE,2025-04-09 00:00:00+00:00,"Pfizer Inc. is a research-based global biopharmaceutical company. It discovers, develops, manufactures, and commercializes medicines and vaccines. Pfizer's portfolio includes products for a wide range of therapeutic areas, including oncology, inflammation, cardiovascular, and infectious diseases.",6134250,369
370,PCG,PG&E Corporation,Utilities,NASDAQ,2025-04-09 00:00:00+00:00,"PG&E Corporation, through its subsidiary, Pacific Gas and Electric Company, engages in the transmission and distribution of electricity and natural gas in northern and central California. It serves residential, commercial, industrial, and agricultural customers.",9185698,370
371,PM,Philip Morris International,Consumer Staples,NYSE,2025-04-09 00:00:00+00:00,"Philip Morris International Inc. is a leading international tobacco company engaged in the manufacture and sale of cigarettes, smoke-free products and associated electronic devices and accessories, and other nicotine-containing products in markets outside the U.S. The company's brands include Marlboro, Parliament, and HEETS.",5290276,371
372,PSX,Phillips 66,Energy,NYSE,2025-04-09 00:00:00+00:00,"Phillips 66 is an energy manufacturing and logistics company. It operates through refining, midstream, chemicals, and marketing and specialties segments. The company transforms crude oil and other feedstocks into fuels and petrochemicals.",8509642,372
373,PNW,Pinnacle West Capital,Utilities,NYSE,2025-04-09 00:00:00+00:00,"Pinnacle West Capital Corporation is a holding company. Its primary subsidiary, Arizona Public Service Company (APS), provides retail and wholesale electric services in Arizona. APS serves approximately 1.3 million homes and businesses across the state.",7640526,373
374,PNC,PNC Financial Services,Financials,NYSE,2025-04-09 00:00:00+00:00,"PNC Financial Services Group, Inc. is a diversified financial services company. It provides retail banking, corporate and institutional banking, asset management, and residential mortgage services. PNC operates primarily in the Eastern United States.",6086889,374
375,POOL,Pool Corporation,Consumer Discretionary,NASDAQ,2025-04-09 00:00:00+00:00,"Pool Corporation is the world's largest wholesale distributor of swimming pool supplies, equipment, and related leisure products. They operate primarily in North America, Europe, and Australia, serving a customer base of professional contractors and retailers.",7667296,375
